{
  "version": "2.1.0",
  "generated_at": "2026-06-08T00:00:00Z",
  "workflow_id": "wf_20260608_000000",
  "topic": "Example: [Product/Technology] applications in [deployment scenario]",
  "audience": [
    "Engineers",
    "Procurement Managers",
    "Project Managers"
  ],
  "industry_context": {
    "industry": "[Your Industry]",
    "market_segment": "B2B [Your Product Category] for [Customer Segment]",
    "core_advantage": "[Core capability] under [important operating condition]"
  },
  "key_claims": [
    {
      "claim": "[Solution category] can operate under [condition] without [auxiliary workaround].",
      "source": {
        "type": "research",
        "reference": "Research notes: [Journal/Report Name], 2026-06-08",
        "url": "https://example.com/source",
        "credibility": "high",
        "verified_by": "tech-research",
        "verified_at": "2026-06-08T00:00:00Z"
      },
      "confidence": "high",
      "data": {
        "metric": "[performance metric]",
        "value": 92,
        "unit": "%",
        "conditions": "[test conditions]"
      }
    },
    {
      "claim": "Eliminating [auxiliary workaround] may reduce total system weight by approximately 30% under [stated assumptions].",
      "source": {
        "type": "pdf",
        "reference": "technical_whitepaper.pdf:Page 12",
        "credibility": "medium",
        "verified_by": "tech-file-parser",
        "verified_at": "2026-06-08T00:00:00Z"
      },
      "confidence": "medium"
    }
  ],
  "extracted_tables": [
    {
      "table_id": "table_1",
      "source": "performance_test_results.xlsx:Sheet1!A1:C5",
      "title": "Performance Comparison Under [Condition]",
      "description": "[Performance metric] and [secondary metric] across operating conditions.",
      "columns": [
        {
          "name": "Condition",
          "type": "string"
        },
        {
          "name": "Performance Retention",
          "type": "number",
          "unit": "%"
        },
        {
          "name": "Secondary Rate",
          "type": "number",
          "unit": "x"
        }
      ],
      "data": [
        {
          "Condition": "[extreme threshold]",
          "Performance Retention": 92,
          "Secondary Rate": 0.5
        },
        {
          "Condition": "[moderate threshold]",
          "Performance Retention": 95,
          "Secondary Rate": 1.0
        },
        {
          "Condition": "[baseline]",
          "Performance Retention": 100,
          "Secondary Rate": 3.0
        }
      ],
      "data_format": "array_of_objects",
      "extracted_at": "2026-06-08T00:00:00Z",
      "notes": "Values are examples; replace with source-backed data only."
    },
    {
      "table_id": "table_2",
      "source": "certification_report.pdf:Page 5",
      "title": "Certification Summary",
      "description": "Safety and compliance certification status.",
      "columns": [
        {
          "name": "Standard",
          "type": "string"
        },
        {
          "name": "Status",
          "type": "string"
        },
        {
          "name": "Date",
          "type": "date"
        }
      ],
      "data": [
        {
          "Standard": "[Standard 1]",
          "Status": "Passed",
          "Date": "2026-01-20"
        },
        {
          "Standard": "[Standard 2]",
          "Status": "Passed",
          "Date": "2026-02-05"
        }
      ],
      "data_format": "array_of_objects",
      "extracted_at": "2026-06-08T00:00:00Z"
    }
  ],
  "glossary": [
    {
      "term": "[Core Capability Term]",
      "definition": "Ability to perform [operation] under [condition] without [workaround].",
      "context": "Critical advantage for [target deployment scenario]."
    },
    {
      "term": "[Performance Metric] Retention",
      "definition": "Percentage of rated [performance metric] available under a stated condition compared with baseline conditions.",
      "context": "Key metric for evaluating performance under [condition]."
    }
  ],
  "risk_notes": [
    {
      "risk_type": "conflict",
      "description": "Two sources report different [secondary metric] values under [condition].",
      "severity": "high",
      "mitigation": "Verify which source is current before drafting the claim."
    },
    {
      "risk_type": "data_gap",
      "description": "No long-term field data found for [lifecycle metric].",
      "severity": "medium",
      "mitigation": "Flag the gap in the article or collect additional field evidence."
    }
  ],
  "research_summary": {
    "sources_count": 12,
    "last_updated": "2026-06-08T00:00:00Z",
    "key_findings": [
      "[Target scenario] requires [resource range] continuous [output].",
      "Conventional alternatives require [workaround] below [threshold].",
      "[Solution category] may reduce total cost of ownership under [assumptions]."
    ]
  },
  "file_summary": {
    "files_processed": [
      "performance_test_results.xlsx",
      "certification_report.pdf",
      "technical_whitepaper.pdf"
    ],
    "total_pages": 47,
    "extraction_notes": [
      "Excel file contained 3 sheets; processed all successfully.",
      "Certification report had text quality issues on pages 8-9; critical data was extracted."
    ]
  },
  "metadata": {
    "files_processed": 3,
    "research_sources": 12,
    "total_data_points": 12,
    "processing_time_seconds": 90
  }
}
